{
  "$schema": "https://json-schema.org/draft/2020-12/schema",
  "$id": "https://freelip.local/schemas/log_event.schema.json",
  "title": "LogEvent",
  "type": "object",
  "additionalProperties": false,
  "required": [
    "schema_version",
    "event_id",
    "level",
    "event_type",
    "message",
    "timestamp_ms"
  ],
  "properties": {
    "schema_version": { "const": "1.0.0" },
    "event_id": { "type": "string", "minLength": 1, "maxLength": 128 },
    "session_id": { "type": "string", "minLength": 1, "maxLength": 128 },
    "level": { "type": "string", "enum": ["debug", "info", "warn", "error"] },
    "event_type": { "type": "string", "minLength": 1, "maxLength": 128 },
    "message": { "type": "string", "minLength": 1, "maxLength": 512 },
    "timestamp_ms": { "type": "integer", "minimum": 0 },
    "fields": {
      "type": "object",
      "propertyNames": {
        "not": {
          "enum": [
            "roi_bytes",
            "roi_frames",
            "video_path",
            "video_bytes",
            "image_base64",
            "image",
            "embedding",
            "debug_clip_path",
            "screenshot"
          ]
        }
      },
      "additionalProperties": {
        "anyOf": [
          { "type": "string", "maxLength": 512 },
          { "type": "number" },
          { "type": "integer" },
          { "type": "boolean" },
          { "type": "null" },
          {
            "type": "array",
            "maxItems": 32,
            "items": {
              "anyOf": [
                { "type": "string", "maxLength": 512 },
                { "type": "number" },
                { "type": "integer" },
                { "type": "boolean" },
                { "type": "null" }
              ]
            }
          }
        ]
      }
    }
  }
}
